id,name,ability_code,ability_text,breaks_system
C01,Проводник,discount_1,Открывает порталы на 1 Искру дешевле любого цвета минимум 1,стоимость портала
C02,Кладоискатель,bag_bonus,При успешном вытягивании из мешка берёт доп жетон без повторной попытки,награда мешка
C03,Друид,flex_2to1,Раз за ход меняет 2 любые свои Искры на 1 нужного цвета,гибкость ресурса
C04,Хранитель Пути,trap_shield_1,Раз за партию превращает вытянутую Ловушку в пустой жетон,безопасность мешка
C05,Наблюдатель,peek_deck,В начале хода тайно смотрит верхнюю карту колоды Порталов,информация о рынке
C06,Летописец,objective_choice,В начале партии видит 2 тайные цели оставляет одну,распределение целей
